{
  "vendor": "juniper_srx",
  "device": "fw-snapshot",
  "schema_version": 3,
  "mode": "enriched",
  "rule_count": 1,
  "evaluation_model": {
    "context_selection_order": [
      "intra_zone",
      "inter_zone",
      "global",
      "implicit_default_deny"
    ],
    "rule_order_within_context": "top_down_first_match",
    "default_action": "deny"
  },
  "contexts": [
    {
      "context": {
        "context_id": "inter_zone:trust->untrust",
        "scope": "inter_zone",
        "priority_rank": 2,
        "context_order": 1,
        "rulebase": "security_policies",
        "from_zone": "trust",
        "to_zone": "untrust"
      },
      "rule_count": 1,
      "rules": [
        {
          "vendor_rule_id": "unresolved-rule",
          "name": "unresolved-rule",
          "source": [
            "mystery-host"
          ],
          "destination": [
            "unknown-net"
          ],
          "service": [
            "custom-undefined"
          ],
          "action": "allow",
          "enabled": true,
          "sequence": 1,
          "hit_count": null,
          "source_refs": [
            "mystery-host"
          ],
          "destination_refs": [
            "unknown-net"
          ],
          "service_refs": [
            "custom-undefined"
          ],
          "service_details": [
            {
              "label": "custom-undefined",
              "resolved": false
            }
          ]
        }
      ]
    }
  ]
}
